docs/science-guide/atbd-l2-fh/targets.json

{
 "doc": "science-guide/atbd-l2-fh",
 "title": "BPS FH ATBD - Algorithms Theoretical Baseline Document",
 "short_title": "L2 FH ATBD",
 "doc_code": "BIO-BPS-FH-ATBD-ARE-10343",
 "pdf_url": "https://www.biomass-disc.info/assets/documents/BPS_v4.4.2/BPS_FH_ATBD_v2_2_0.pdf",
 "targets": {
  "ad:1": {
   "file": "01-introduction",
   "anchor": "ad1"
  },
  "ad:2": {
   "file": "01-introduction",
   "anchor": "ad2"
  },
  "ad:3": {
   "file": "01-introduction",
   "anchor": "ad3"
  },
  "eq:3.1": {
   "file": "03-forest-height",
   "anchor": "equation-eq-atbd-fh-3-1"
  },
  "eq:3.10": {
   "file": "03-forest-height",
   "anchor": "equation-eq-atbd-fh-3-10"
  },
  "eq:3.11": {
   "file": "03-forest-height",
   "anchor": "equation-eq-atbd-fh-3-11"
  },
  "eq:3.12": {
   "file": "03-forest-height",
   "anchor": "equation-eq-atbd-fh-3-12"
  },
  "eq:3.13": {
   "file": "03-forest-height",
   "anchor": "equation-eq-atbd-fh-3-13"
  },
  "eq:3.14": {
   "file": "03-forest-height",
   "anchor": "equation-eq-atbd-fh-3-14"
  },
  "eq:3.15": {
   "file": "03-forest-height",
   "anchor": "equation-eq-atbd-fh-3-15"
  },
  "eq:3.16": {
   "file": "03-forest-height",
   "anchor": "equation-eq-atbd-fh-3-16"
  },
  "eq:3.17": {
   "file": "03-forest-height",
   "anchor": "equation-eq-atbd-fh-3-17"
  },
  "eq:3.18": {
   "file": "03-forest-height",
   "anchor": "equation-eq-atbd-fh-3-18"
  },
  "eq:3.19": {
   "file": "03-forest-height",
   "anchor": "equation-eq-atbd-fh-3-19"
  },
  "eq:3.2": {
   "file": "03-forest-height",
   "anchor": "equation-eq-atbd-fh-3-2"
  },
  "eq:3.20": {
   "file": "03-forest-height",
   "anchor": "equation-eq-atbd-fh-3-20"
  },
  "eq:3.21": {
   "file": "03-forest-height",
   "anchor": "equation-eq-atbd-fh-3-21"
  },
  "eq:3.22": {
   "file": "03-forest-height",
   "anchor": "equation-eq-atbd-fh-3-22"
  },
  "eq:3.23": {
   "file": "03-forest-height",
   "anchor": "equation-eq-atbd-fh-3-23"
  },
  "eq:3.24": {
   "file": "03-forest-height",
   "anchor": "equation-eq-atbd-fh-3-24"
  },
  "eq:3.25": {
   "file": "03-forest-height",
   "anchor": "equation-eq-atbd-fh-3-25"
  },
  "eq:3.26": {
   "file": "03-forest-height",
   "anchor": "equation-eq-atbd-fh-3-26"
  },
  "eq:3.27": {
   "file": "03-forest-height",
   "anchor": "equation-eq-atbd-fh-3-27"
  },
  "eq:3.28": {
   "file": "03-forest-height",
   "anchor": "equation-eq-atbd-fh-3-28"
  },
  "eq:3.3": {
   "file": "03-forest-height",
   "anchor": "equation-eq-atbd-fh-3-3"
  },
  "eq:3.4": {
   "file": "03-forest-height",
   "anchor": "equation-eq-atbd-fh-3-4"
  },
  "eq:3.5": {
   "file": "03-forest-height",
   "anchor": "equation-eq-atbd-fh-3-5"
  },
  "eq:3.6": {
   "file": "03-forest-height",
   "anchor": "equation-eq-atbd-fh-3-6"
  },
  "eq:3.7": {
   "file": "03-forest-height",
   "anchor": "equation-eq-atbd-fh-3-7"
  },
  "eq:3.8": {
   "file": "03-forest-height",
   "anchor": "equation-eq-atbd-fh-3-8"
  },
  "eq:3.9": {
   "file": "03-forest-height",
   "anchor": "equation-eq-atbd-fh-3-9"
  },
  "eq:4.1": {
   "file": "04-forest-height-aggregation",
   "anchor": "equation-eq-atbd-fh-4-1"
  },
  "eq:4.3": {
   "file": "04-forest-height-aggregation",
   "anchor": "equation-eq-atbd-fh-4-3"
  },
  "eq:4.4": {
   "file": "04-forest-height-aggregation",
   "anchor": "equation-eq-atbd-fh-4-4"
  },
  "fig:1": {
   "file": "02-bps-and-fh-processing-overview",
   "anchor": "fig-atbd-fh-1"
  },
  "fig:10": {
   "file": "03-forest-height",
   "anchor": "fig-atbd-fh-10"
  },
  "fig:11": {
   "file": "03-forest-height",
   "anchor": "fig-atbd-fh-11"
  },
  "fig:12": {
   "file": "03-forest-height",
   "anchor": "fig-atbd-fh-12"
  },
  "fig:13": {
   "file": "04-forest-height-aggregation",
   "anchor": "fig-atbd-fh-13"
  },
  "fig:14": {
   "file": "04-forest-height-aggregation",
   "anchor": "fig-atbd-fh-14"
  },
  "fig:2": {
   "file": "02-bps-and-fh-processing-overview",
   "anchor": "fig-atbd-fh-2"
  },
  "fig:3": {
   "file": "02-bps-and-fh-processing-overview",
   "anchor": "fig-atbd-fh-3"
  },
  "fig:4": {
   "file": "03-forest-height",
   "anchor": "fig-atbd-fh-4"
  },
  "fig:5": {
   "file": "03-forest-height",
   "anchor": "fig-atbd-fh-5"
  },
  "fig:6": {
   "file": "03-forest-height",
   "anchor": "fig-atbd-fh-6"
  },
  "fig:7": {
   "file": "03-forest-height",
   "anchor": "fig-atbd-fh-7"
  },
  "fig:8": {
   "file": "03-forest-height",
   "anchor": "fig-atbd-fh-8"
  },
  "fig:9": {
   "file": "03-forest-height",
   "anchor": "fig-atbd-fh-9"
  },
  "rd:1": {
   "file": "01-introduction",
   "anchor": "rd1"
  },
  "rd:10": {
   "file": "01-introduction",
   "anchor": "rd10"
  },
  "rd:11": {
   "file": "01-introduction",
   "anchor": "rd11"
  },
  "rd:12": {
   "file": "01-introduction",
   "anchor": "rd12"
  },
  "rd:13": {
   "file": "01-introduction",
   "anchor": "rd13"
  },
  "rd:14": {
   "file": "01-introduction",
   "anchor": "rd14"
  },
  "rd:15": {
   "file": "01-introduction",
   "anchor": "rd15"
  },
  "rd:2": {
   "file": "01-introduction",
   "anchor": "rd2"
  },
  "rd:3": {
   "file": "01-introduction",
   "anchor": "rd3"
  },
  "rd:4": {
   "file": "01-introduction",
   "anchor": "rd4"
  },
  "rd:5": {
   "file": "01-introduction",
   "anchor": "rd5"
  },
  "rd:6": {
   "file": "01-introduction",
   "anchor": "rd6"
  },
  "rd:7": {
   "file": "01-introduction",
   "anchor": "rd7"
  },
  "rd:8": {
   "file": "01-introduction",
   "anchor": "rd8"
  },
  "rd:9": {
   "file": "01-introduction",
   "anchor": "rd9"
  },
  "sec:1": {
   "file": "01-introduction",
   "anchor": "sec-atbd-fh-1"
  },
  "sec:1.1": {
   "file": "01-introduction",
   "anchor": "sec-atbd-fh-1-1"
  },
  "sec:1.2": {
   "file": "01-introduction",
   "anchor": "sec-atbd-fh-1-2"
  },
  "sec:1.3": {
   "file": "01-introduction",
   "anchor": "sec-atbd-fh-1-3"
  },
  "sec:1.4": {
   "file": "01-introduction",
   "anchor": "sec-atbd-fh-1-4"
  },
  "sec:1.5": {
   "file": "01-introduction",
   "anchor": "sec-atbd-fh-1-5"
  },
  "sec:1.6": {
   "file": "01-introduction",
   "anchor": "sec-atbd-fh-1-6"
  },
  "sec:2": {
   "file": "02-bps-and-fh-processing-overview",
   "anchor": "sec-atbd-fh-2"
  },
  "sec:2.1": {
   "file": "02-bps-and-fh-processing-overview",
   "anchor": "sec-atbd-fh-2-1"
  },
  "sec:2.2": {
   "file": "02-bps-and-fh-processing-overview",
   "anchor": "sec-atbd-fh-2-2"
  },
  "sec:2.3": {
   "file": "02-bps-and-fh-processing-overview",
   "anchor": "sec-atbd-fh-2-3"
  },
  "sec:2.3.1": {
   "file": "02-bps-and-fh-processing-overview",
   "anchor": "sec-atbd-fh-2-3-1"
  },
  "sec:2.3.2": {
   "file": "02-bps-and-fh-processing-overview",
   "anchor": "sec-atbd-fh-2-3-2"
  },
  "sec:2.3.3": {
   "file": "02-bps-and-fh-processing-overview",
   "anchor": "sec-atbd-fh-2-3-3"
  },
  "sec:3": {
   "file": "03-forest-height",
   "anchor": "sec-atbd-fh-3"
  },
  "sec:3.1": {
   "file": "03-forest-height",
   "anchor": "sec-atbd-fh-3-1"
  },
  "sec:3.1.1": {
   "file": "03-forest-height",
   "anchor": "sec-atbd-fh-3-1-1"
  },
  "sec:3.1.2": {
   "file": "03-forest-height",
   "anchor": "sec-atbd-fh-3-1-2"
  },
  "sec:3.1.3": {
   "file": "03-forest-height",
   "anchor": "sec-atbd-fh-3-1-3"
  },
  "sec:3.1.4": {
   "file": "03-forest-height",
   "anchor": "sec-atbd-fh-3-1-4"
  },
  "sec:3.1.5": {
   "file": "03-forest-height",
   "anchor": "sec-atbd-fh-3-1-5"
  },
  "sec:3.2": {
   "file": "03-forest-height",
   "anchor": "sec-atbd-fh-3-2"
  },
  "sec:3.2.1": {
   "file": "03-forest-height",
   "anchor": "sec-atbd-fh-3-2-1"
  },
  "sec:3.2.2": {
   "file": "03-forest-height",
   "anchor": "sec-atbd-fh-3-2-2"
  },
  "sec:3.2.3": {
   "file": "03-forest-height",
   "anchor": "sec-atbd-fh-3-2-3"
  },
  "sec:3.2.4": {
   "file": "03-forest-height",
   "anchor": "sec-atbd-fh-3-2-4"
  },
  "sec:3.2.4.1": {
   "file": "03-forest-height",
   "anchor": "sec-atbd-fh-3-2-4-1"
  },
  "sec:3.3": {
   "file": "03-forest-height",
   "anchor": "sec-atbd-fh-3-3"
  },
  "sec:3.3.1": {
   "file": "03-forest-height",
   "anchor": "sec-atbd-fh-3-3-1"
  },
  "sec:3.3.2": {
   "file": "03-forest-height",
   "anchor": "sec-atbd-fh-3-3-2"
  },
  "sec:3.3.3": {
   "file": "03-forest-height",
   "anchor": "sec-atbd-fh-3-3-3"
  },
  "sec:3.3.4": {
   "file": "03-forest-height",
   "anchor": "sec-atbd-fh-3-3-4"
  },
  "sec:3.4": {
   "file": "03-forest-height",
   "anchor": "sec-atbd-fh-3-4"
  },
  "sec:3.4.1": {
   "file": "03-forest-height",
   "anchor": "sec-atbd-fh-3-4-1"
  },
  "sec:3.4.2": {
   "file": "03-forest-height",
   "anchor": "sec-atbd-fh-3-4-2"
  },
  "sec:3.4.3": {
   "file": "03-forest-height",
   "anchor": "sec-atbd-fh-3-4-3"
  },
  "sec:3.4.4": {
   "file": "03-forest-height",
   "anchor": "sec-atbd-fh-3-4-4"
  },
  "sec:3.4.4.1": {
   "file": "03-forest-height",
   "anchor": "sec-atbd-fh-3-4-4-1"
  },
  "sec:3.4.4.2": {
   "file": "03-forest-height",
   "anchor": "sec-atbd-fh-3-4-4-2"
  },
  "sec:3.4.4.3": {
   "file": "03-forest-height",
   "anchor": "sec-atbd-fh-3-4-4-3"
  },
  "sec:3.4.5": {
   "file": "03-forest-height",
   "anchor": "sec-atbd-fh-3-4-5"
  },
  "sec:3.5": {
   "file": "03-forest-height",
   "anchor": "sec-atbd-fh-3-5"
  },
  "sec:3.5.1": {
   "file": "03-forest-height",
   "anchor": "sec-atbd-fh-3-5-1"
  },
  "sec:3.5.2": {
   "file": "03-forest-height",
   "anchor": "sec-atbd-fh-3-5-2"
  },
  "sec:3.5.3": {
   "file": "03-forest-height",
   "anchor": "sec-atbd-fh-3-5-3"
  },
  "sec:3.5.4": {
   "file": "03-forest-height",
   "anchor": "sec-atbd-fh-3-5-4"
  },
  "sec:3.5.4.1.1": {
   "file": "03-forest-height",
   "anchor": "sec-atbd-fh-3-5-4-1-1"
  },
  "sec:3.5.4.1.2": {
   "file": "03-forest-height",
   "anchor": "sec-atbd-fh-3-5-4-1-2"
  },
  "sec:3.5.4.1.3": {
   "file": "03-forest-height",
   "anchor": "sec-atbd-fh-3-5-4-1-3"
  },
  "sec:3.5.4.1.4": {
   "file": "03-forest-height",
   "anchor": "sec-atbd-fh-3-5-4-1-4"
  },
  "sec:3.5.4.1.5": {
   "file": "03-forest-height",
   "anchor": "sec-atbd-fh-3-5-4-1-5"
  },
  "sec:3.5.4.1.6": {
   "file": "03-forest-height",
   "anchor": "sec-atbd-fh-3-5-4-1-6"
  },
  "sec:3.5.4.1.7": {
   "file": "03-forest-height",
   "anchor": "sec-atbd-fh-3-5-4-1-7"
  },
  "sec:3.5.4.1.8": {
   "file": "03-forest-height",
   "anchor": "sec-atbd-fh-3-5-4-1-8"
  },
  "sec:3.6": {
   "file": "03-forest-height",
   "anchor": "sec-atbd-fh-3-6"
  },
  "sec:3.6.1": {
   "file": "03-forest-height",
   "anchor": "sec-atbd-fh-3-6-1"
  },
  "sec:3.6.2": {
   "file": "03-forest-height",
   "anchor": "sec-atbd-fh-3-6-2"
  },
  "sec:3.6.3": {
   "file": "03-forest-height",
   "anchor": "sec-atbd-fh-3-6-3"
  },
  "sec:3.6.4": {
   "file": "03-forest-height",
   "anchor": "sec-atbd-fh-3-6-4"
  },
  "sec:3.6.4.1.1": {
   "file": "03-forest-height",
   "anchor": "sec-atbd-fh-3-6-4-1-1"
  },
  "sec:3.6.4.1.2": {
   "file": "03-forest-height",
   "anchor": "sec-atbd-fh-3-6-4-1-2"
  },
  "sec:3.7": {
   "file": "03-forest-height",
   "anchor": "sec-atbd-fh-3-7"
  },
  "sec:3.7.1": {
   "file": "03-forest-height",
   "anchor": "sec-atbd-fh-3-7-1"
  },
  "sec:3.7.2": {
   "file": "03-forest-height",
   "anchor": "sec-atbd-fh-3-7-2"
  },
  "sec:3.7.3": {
   "file": "03-forest-height",
   "anchor": "sec-atbd-fh-3-7-3"
  },
  "sec:3.7.4": {
   "file": "03-forest-height",
   "anchor": "sec-atbd-fh-3-7-4"
  },
  "sec:4": {
   "file": "04-forest-height-aggregation",
   "anchor": "sec-atbd-fh-4"
  },
  "sec:4.1": {
   "file": "04-forest-height-aggregation",
   "anchor": "sec-atbd-fh-4-1"
  },
  "sec:4.1.1": {
   "file": "04-forest-height-aggregation",
   "anchor": "sec-atbd-fh-4-1-1"
  },
  "sec:4.1.2": {
   "file": "04-forest-height-aggregation",
   "anchor": "sec-atbd-fh-4-1-2"
  },
  "sec:4.1.3": {
   "file": "04-forest-height-aggregation",
   "anchor": "sec-atbd-fh-4-1-3"
  },
  "sec:4.1.4": {
   "file": "04-forest-height-aggregation",
   "anchor": "sec-atbd-fh-4-1-4"
  },
  "sec:4.1.4.1": {
   "file": "04-forest-height-aggregation",
   "anchor": "sec-atbd-fh-4-1-4-1"
  },
  "sec:4.1.4.2": {
   "file": "04-forest-height-aggregation",
   "anchor": "sec-atbd-fh-4-1-4-2"
  }
 }
}

docs/science-guide/atbd-l1-sar/03-l1-pre-processing.md

$$
PGP_{IJ}\left( \tau,m \right]=\frac{1}{\widehat{F}\left[ m \right]}\cdot\mathcal{F}^{-1}\left\{ \frac{\mathcal{F}\left\{ S_I^{Tx}(\tau,m] \right\}\mathcal{\cdot{}F}\left\{ S_J^{Rx}(\tau,m] \right\}}{\mathcal{F}\left\{ S_J^{Scal}(\tau,m] \right\}} \right\}
\tag{3.10}
$$ (eq:atbd-l1-sar-3-10)

$$
PGP_{IJ}^{comp}(\tau,m]=\mathcal{F}_{\tau}^{-1}\left\{ \mathcal{F}_{\tau}\left\{ PGP_{IJ}(\tau,m] \right\}\cdot(\mathcal{F}_{\tau}\left\{ S_{ref}^{TXP}(\tau) \right\})^* \right\}
\tag{3.11}
$$ (eq:atbd-l1-sar-3-11)

$$
{PGP}_{IJ}^{comp,int}(\tau,m\mathbb{]=Z}\left\{ {PGP}_{IJ}^{comp}(\tau,m]) \right\}
\tag{3.12}
$$ (eq:atbd-l1-sar-3-12)

$$
\tau_{max,IJ}^{}[m]=maxpos\left\{ \left\vert {PGP}_{IJ}^{comp,int}(\tau,m] \right\vert \right\}
\tag{3.13}
$$ (eq:atbd-l1-sar-3-13)

(equation-eq-atbd-l1-sar-3-14)=
\begin{equation}
\begin{aligned}
A_{drift}^{'}\left[ m \right]=abs\left\{ PGP_{IJ}^{comp,ZP}(\tau_{\max,IJ}[m],m] \right\} \\
\varphi_{drift}^{'}\left[ m \right]=\arg \left\{ PGP_{IJ}^{comp,ZP}(\tau_{max,IJ}[m],m] \right\}
\end{aligned}
\tag{3.14}
\end{equation}

(equation-eq-atbd-l1-sar-3-15)=
\begin{equation}
\begin{aligned}
\mu_A=mean\left\{ A_{drift}^{'} \right\} \\
\sigma_A=stddev\left\{ A_{drift}^{'} \right\} \\
\mu_{\varphi}=mean\left\{ \varphi_{drift}^{'} \right\} \\
\sigma_{\varphi}=stddev\left\{ \varphi_{drift}^{'} \right\}
\end{aligned}
\tag{3.15}
\end{equation}

(equation-eq-atbd-l1-sar-3-16)=
\begin{equation}
\begin{aligned}
\left\vert A_{drift}^{'}\left[ m \right]-\mu_A \right\vert<\alpha_A^{User}\cdot\sigma_A \\
\left\vert \varphi_{drift}^{'}\left[ m \right]-\mu_{\varphi} \right\vert<\alpha_{\varphi}^{User}\cdot\sigma_{\varphi}
\end{aligned}
\tag{3.16}
\end{equation}

(equation-eq-atbd-l1-sar-3-17)=
\begin{equation}
\begin{aligned}
A_{drift}\left[ n \right]=\ \Gamma\left\{ A_{drift}^{'}\left[ m \right];{t_{PGP}\left[ m \right]\rightarrow{}t}_{DT}\left[ n \right] \right\} \\
\varphi_{drift}\left[ n \right]=\arg \left\{ \Gamma\left\{ \exp \left[ j\cdot\varphi_{drift}^{'}[m] \right];{t_{PGP}\left[ m \right]\rightarrow{}t}_{DT}\left[ n \right] \right\} \right\}
\end{aligned}
\tag{3.17}
\end{equation}

$$
\overline{PGP_{IJ}}(f_r)=\frac{1}{M}\sum_{TXPIDX[m]}^{}{\frac{1}{A_{drift}^{'}\left[ m \right]\cdot\exp (j\cdot\varphi_{drift}^{'}[m])}\mathcal{F}_{\tau}\left\{ PGP_{IJ}(\tau,m] \right\}}
\tag{3.18}
$$ (eq:atbd-l1-sar-3-18)

$$
S_{rep,IJ}^{TXP}(\tau)=\mathcal{F}_{\tau}^{-1}\left\{ {\overline{PGP_{IJ}}}^*(f_r) \right\}.
\tag{3.19}
$$ (eq:atbd-l1-sar-3-19)

(equation-eq-atbd-l1-sar-3-20)=
\begin{equation}
\begin{aligned}
E_{factor}=\sqrt{\sum_{\tau}^{}{\left\vert S_{rep,IJ}^{TXP}(\tau) \right\vert^2}\cdot\frac{f_s}{B_r}} \\
S_{rep,IJ}^{TXP}(\tau)=\frac{S_{rep,IJ}^{TXP}(\tau)}{E_{factor}}
\end{aligned}
\tag{3.20}
\end{equation}

$$
S_{comp,IJ}^{TXP}(\tau)=\mathcal{F}_{\tau}^{-1}\left\{ \mathcal{F}\left\{ S_{rep,IJ}^{TXP}(\tau) \right\}\mathcal{\cdot{}F}\left\{ S_{ref,IJ}^{TXP}(\tau) \right\} \right\}
\tag{3.21}
$$ (eq:atbd-l1-sar-3-21)

$$
p_{max,IJ}^{TXP}\mathbb{=Q}\left\{ S_{comp,IJ}^{TXP}(\tau) \right\}
\tag{3.22}
$$ (eq:atbd-l1-sar-3-22)

$$
\delta\tau_{IJ}^{TXP}=\frac{p_{max,IJ}^{TXP}-p_{max,VV}^{TXP}}{f_s}
\tag{3.23}
$$ (eq:atbd-l1-sar-3-23)

$$
{\widetilde{S}}_j^x(f_r)=\frac{1}{M}\sum_m^{}{\mathcal{F}_{\tau}\left\{ S_j^x(\tau,m] \right\}}
\tag{3.24}
$$ (eq:atbd-l1-sar-3-24)

$$
S_j^{x,comp}(\tau)=\mathcal{F}^{-1}\left\{ {\widetilde{S}}_j^x(f_r)\cdot(\mathcal{F}\left\{ S_{ref}(\tau) \right\})^* \right\}
\tag{3.25}
$$ (eq:atbd-l1-sar-3-25)

$$
S_j^{x,comp,int}(\tau\mathbb{)=Z}\left\{ S_j^{x,comp}(\tau) \right\}
\tag{3.26}
$$ (eq:atbd-l1-sar-3-26)

$$
a_j^x=\max \left\{ S_j^{x,comp,int}(\tau) \right\}
\tag{3.27}
$$ (eq:atbd-l1-sar-3-27)

$$
CI_{Norm}[m\mathcal{]=L}\left\{ LUT_{PAS};T_{inst}[m] \right\}
\tag{3.28}
$$ (eq:atbd-l1-sar-3-28)