docs/science-guide/atbd-l2-agb/targets.json

{
 "doc": "science-guide/atbd-l2-agb",
 "title": "BPS AGB ATBD - Algorithms Theoretical Baseline Document",
 "short_title": "L2 AGB ATBD",
 "doc_code": "BIO-BPS-AGB-ATBD-ARE-024912",
 "pdf_url": "https://www.biomass-disc.info/assets/documents/BPS_v4.4.2/BPS_AGB_ATBD_v3_1_4.pdf",
 "targets": {
  "ad:1": {
   "file": "01-introduction",
   "anchor": "ad1"
  },
  "ad:2": {
   "file": "01-introduction",
   "anchor": "ad2"
  },
  "ad:3": {
   "file": "01-introduction",
   "anchor": "ad3"
  },
  "eq:3.1": {
   "file": "03-ground-cancellation",
   "anchor": "equation-eq-forest-coverage-check-1"
  },
  "eq:3.10": {
   "file": "03-ground-cancellation",
   "anchor": "equation-eq-ground-cancellation-7"
  },
  "eq:3.11": {
   "file": "03-ground-cancellation",
   "anchor": "equation-eq-ground-cancellation-8"
  },
  "eq:3.12": {
   "file": "03-ground-cancellation",
   "anchor": "equation-eq-ground-cancellation-9"
  },
  "eq:3.13": {
   "file": "03-ground-cancellation",
   "anchor": "equation-eq-sigma-naught-normalisation-1"
  },
  "eq:3.14": {
   "file": "03-ground-cancellation",
   "anchor": "equation-eq-sigma-naught-normalisation-2"
  },
  "eq:3.15": {
   "file": "03-ground-cancellation",
   "anchor": "equation-eq-sigma-naught-normalisation-3"
  },
  "eq:3.16": {
   "file": "03-ground-cancellation",
   "anchor": "equation-eq-geocoding-1"
  },
  "eq:3.17": {
   "file": "03-ground-cancellation",
   "anchor": "equation-eq-geocoding-2"
  },
  "eq:3.18": {
   "file": "03-ground-cancellation",
   "anchor": "equation-eq-geocoding-3"
  },
  "eq:3.19": {
   "file": "03-ground-cancellation",
   "anchor": "equation-eq-fnf-annotation-1"
  },
  "eq:3.2": {
   "file": "03-ground-cancellation",
   "anchor": "equation-eq-calibration-1"
  },
  "eq:3.20": {
   "file": "03-ground-cancellation",
   "anchor": "equation-eq-fnf-annotation-2"
  },
  "eq:3.3": {
   "file": "03-ground-cancellation",
   "anchor": "equation-eq-calibration-2"
  },
  "eq:3.4": {
   "file": "03-ground-cancellation",
   "anchor": "equation-eq-ground-cancellation-1"
  },
  "eq:3.5": {
   "file": "03-ground-cancellation",
   "anchor": "equation-eq-ground-cancellation-2"
  },
  "eq:3.6": {
   "file": "03-ground-cancellation",
   "anchor": "equation-eq-ground-cancellation-3"
  },
  "eq:3.7": {
   "file": "03-ground-cancellation",
   "anchor": "equation-eq-ground-cancellation-4"
  },
  "eq:3.8": {
   "file": "03-ground-cancellation",
   "anchor": "equation-eq-ground-cancellation-5"
  },
  "eq:3.9": {
   "file": "03-ground-cancellation",
   "anchor": "equation-eq-ground-cancellation-6"
  },
  "eq:4.1": {
   "file": "04-agb-estimation",
   "anchor": "equation-eq-model-parameter-estimation-1"
  },
  "eq:4.10": {
   "file": "04-agb-estimation",
   "anchor": "equation-eq-model-parameter-estimation-10"
  },
  "eq:4.11": {
   "file": "04-agb-estimation",
   "anchor": "equation-eq-model-parameter-estimation-11"
  },
  "eq:4.12": {
   "file": "04-agb-estimation",
   "anchor": "equation-eq-model-parameter-estimation-12"
  },
  "eq:4.13": {
   "file": "04-agb-estimation",
   "anchor": "equation-eq-model-parameter-estimation-13"
  },
  "eq:4.14": {
   "file": "04-agb-estimation",
   "anchor": "equation-eq-model-parameter-estimation-14"
  },
  "eq:4.15": {
   "file": "04-agb-estimation",
   "anchor": "equation-eq-model-parameter-estimation-15"
  },
  "eq:4.16": {
   "file": "04-agb-estimation",
   "anchor": "equation-eq-model-parameter-estimation-16"
  },
  "eq:4.17": {
   "file": "04-agb-estimation",
   "anchor": "equation-eq-model-parameter-estimation-17"
  },
  "eq:4.18": {
   "file": "04-agb-estimation",
   "anchor": "equation-eq-model-parameter-estimation-18"
  },
  "eq:4.19": {
   "file": "04-agb-estimation",
   "anchor": "equation-eq-model-parameter-estimation-19"
  },
  "eq:4.2": {
   "file": "04-agb-estimation",
   "anchor": "equation-eq-model-parameter-estimation-2"
  },
  "eq:4.20": {
   "file": "04-agb-estimation",
   "anchor": "equation-eq-model-parameter-estimation-20"
  },
  "eq:4.21": {
   "file": "04-agb-estimation",
   "anchor": "equation-eq-model-parameter-estimation-21"
  },
  "eq:4.22": {
   "file": "04-agb-estimation",
   "anchor": "equation-eq-model-parameter-estimation-22"
  },
  "eq:4.23": {
   "file": "04-agb-estimation",
   "anchor": "equation-eq-model-parameter-estimation-23"
  },
  "eq:4.24": {
   "file": "04-agb-estimation",
   "anchor": "equation-eq-model-parameter-estimation-24"
  },
  "eq:4.25": {
   "file": "04-agb-estimation",
   "anchor": "equation-eq-model-parameter-estimation-25"
  },
  "eq:4.26": {
   "file": "04-agb-estimation",
   "anchor": "equation-eq-model-parameter-estimation-26"
  },
  "eq:4.27": {
   "file": "04-agb-estimation",
   "anchor": "equation-eq-model-parameter-estimation-27"
  },
  "eq:4.28": {
   "file": "04-agb-estimation",
   "anchor": "equation-eq-model-parameter-estimation-28"
  },
  "eq:4.29": {
   "file": "04-agb-estimation",
   "anchor": "equation-eq-model-parameter-estimation-29"
  },
  "eq:4.3": {
   "file": "04-agb-estimation",
   "anchor": "equation-eq-model-parameter-estimation-3"
  },
  "eq:4.30": {
   "file": "04-agb-estimation",
   "anchor": "equation-eq-model-parameter-estimation-30"
  },
  "eq:4.31": {
   "file": "04-agb-estimation",
   "anchor": "equation-eq-model-parameter-estimation-31"
  },
  "eq:4.32": {
   "file": "04-agb-estimation",
   "anchor": "equation-eq-model-parameter-estimation-32"
  },
  "eq:4.33": {
   "file": "04-agb-estimation",
   "anchor": "equation-eq-model-parameter-estimation-33"
  },
  "eq:4.34": {
   "file": "04-agb-estimation",
   "anchor": "equation-eq-model-parameter-estimation-34"
  },
  "eq:4.35": {
   "file": "04-agb-estimation",
   "anchor": "equation-eq-model-parameter-estimation-35"
  },
  "eq:4.36": {
   "file": "04-agb-estimation",
   "anchor": "equation-eq-model-parameter-estimation-36"
  },
  "eq:4.37": {
   "file": "04-agb-estimation",
   "anchor": "equation-eq-model-parameter-estimation-37"
  },
  "eq:4.38": {
   "file": "04-agb-estimation",
   "anchor": "equation-eq-model-parameter-estimation-38"
  },
  "eq:4.39": {
   "file": "04-agb-estimation",
   "anchor": "equation-eq-model-parameter-estimation-39"
  },
  "eq:4.4": {
   "file": "04-agb-estimation",
   "anchor": "equation-eq-model-parameter-estimation-4"
  },
  "eq:4.40": {
   "file": "04-agb-estimation",
   "anchor": "equation-eq-model-parameter-estimation-40"
  },
  "eq:4.41": {
   "file": "04-agb-estimation",
   "anchor": "equation-eq-model-parameter-estimation-41"
  },
  "eq:4.5": {
   "file": "04-agb-estimation",
   "anchor": "equation-eq-model-parameter-estimation-5"
  },
  "eq:4.6": {
   "file": "04-agb-estimation",
   "anchor": "equation-eq-model-parameter-estimation-6"
  },
  "eq:4.7": {
   "file": "04-agb-estimation",
   "anchor": "equation-eq-model-parameter-estimation-7"
  },
  "eq:4.8": {
   "file": "04-agb-estimation",
   "anchor": "equation-eq-model-parameter-estimation-8"
  },
  "eq:4.9": {
   "file": "04-agb-estimation",
   "anchor": "equation-eq-model-parameter-estimation-9"
  },
  "eq:5.1": {
   "file": "05-appendix",
   "anchor": "equation-eq-appendix-gn-1"
  },
  "fig:1": {
   "file": "02-bps-agb-overview",
   "anchor": "fig-atbd-agb-bps-scheme-tom"
  },
  "fig:10": {
   "file": "03-ground-cancellation",
   "anchor": "fig-atbd-agb-geocoding"
  },
  "fig:11": {
   "file": "03-ground-cancellation",
   "anchor": "fig-atbd-agb-geocoding-forest-point"
  },
  "fig:12": {
   "file": "04-agb-estimation",
   "anchor": "fig-atbd-agb-processing-blocks"
  },
  "fig:13": {
   "file": "04-agb-estimation",
   "anchor": "fig-atbd-agb-l2b-workflow"
  },
  "fig:14": {
   "file": "04-agb-estimation",
   "anchor": "fig-atbd-agb-model-parameter-estimation"
  },
  "fig:15": {
   "file": "04-agb-estimation",
   "anchor": "fig-atbd-agb-agb-mean-std-estimation"
  },
  "fig:2": {
   "file": "02-bps-agb-overview",
   "anchor": "fig-atbd-agb-bps-scheme-int"
  },
  "fig:3": {
   "file": "02-bps-agb-overview",
   "anchor": "fig-atbd-agb-workflow"
  },
  "fig:4": {
   "file": "03-ground-cancellation",
   "anchor": "fig-atbd-agb-int-subset-7"
  },
  "fig:5": {
   "file": "03-ground-cancellation",
   "anchor": "fig-atbd-agb-int-subset-8"
  },
  "fig:6": {
   "file": "03-ground-cancellation",
   "anchor": "fig-atbd-agb-calibration"
  },
  "fig:7": {
   "file": "03-ground-cancellation",
   "anchor": "fig-atbd-agb-gc-two"
  },
  "fig:8": {
   "file": "03-ground-cancellation",
   "anchor": "fig-atbd-agb-gc-multi"
  },
  "fig:9": {
   "file": "03-ground-cancellation",
   "anchor": "fig-atbd-agb-sigma-naught-normalisation"
  },
  "rd:1": {
   "file": "01-introduction",
   "anchor": "rd1"
  },
  "rd:10": {
   "file": "01-introduction",
   "anchor": "rd10"
  },
  "rd:11": {
   "file": "01-introduction",
   "anchor": "rd11"
  },
  "rd:2": {
   "file": "01-introduction",
   "anchor": "rd2"
  },
  "rd:3": {
   "file": "01-introduction",
   "anchor": "rd3"
  },
  "rd:4": {
   "file": "01-introduction",
   "anchor": "rd4"
  },
  "rd:5": {
   "file": "01-introduction",
   "anchor": "rd5"
  },
  "rd:6": {
   "file": "01-introduction",
   "anchor": "rd6"
  },
  "rd:7": {
   "file": "01-introduction",
   "anchor": "rd7"
  },
  "rd:8": {
   "file": "01-introduction",
   "anchor": "rd8"
  },
  "rd:9": {
   "file": "01-introduction",
   "anchor": "rd9"
  },
  "sec:1": {
   "file": "01-introduction",
   "anchor": "sec-atbd-agb-1"
  },
  "sec:1.1": {
   "file": "01-introduction",
   "anchor": "sec-atbd-agb-1-1"
  },
  "sec:1.2": {
   "file": "01-introduction",
   "anchor": "sec-atbd-agb-1-2"
  },
  "sec:1.3": {
   "file": "01-introduction",
   "anchor": "sec-atbd-agb-1-3"
  },
  "sec:1.4": {
   "file": "01-introduction",
   "anchor": "sec-atbd-agb-1-4"
  },
  "sec:1.5": {
   "file": "01-introduction",
   "anchor": "sec-atbd-agb-1-5"
  },
  "sec:2": {
   "file": "02-bps-agb-overview",
   "anchor": "sec-atbd-agb-2"
  },
  "sec:2.1": {
   "file": "02-bps-agb-overview",
   "anchor": "sec-atbd-agb-2-1"
  },
  "sec:2.2": {
   "file": "02-bps-agb-overview",
   "anchor": "sec-atbd-agb-2-2"
  },
  "sec:2.3": {
   "file": "02-bps-agb-overview",
   "anchor": "sec-atbd-agb-2-3"
  },
  "sec:2.3.1": {
   "file": "02-bps-agb-overview",
   "anchor": "sec-atbd-agb-2-3-1"
  },
  "sec:2.3.2": {
   "file": "02-bps-agb-overview",
   "anchor": "sec-atbd-agb-2-3-2"
  },
  "sec:2.3.3": {
   "file": "02-bps-agb-overview",
   "anchor": "sec-atbd-agb-2-3-3"
  },
  "sec:3": {
   "file": "03-ground-cancellation",
   "anchor": "sec-atbd-agb-3"
  },
  "sec:3.1": {
   "file": "03-ground-cancellation",
   "anchor": "sec-atbd-agb-3-1"
  },
  "sec:3.1.1": {
   "file": "03-ground-cancellation",
   "anchor": "sec-atbd-agb-3-1-1"
  },
  "sec:3.1.2": {
   "file": "03-ground-cancellation",
   "anchor": "sec-atbd-agb-3-1-2"
  },
  "sec:3.1.3": {
   "file": "03-ground-cancellation",
   "anchor": "sec-atbd-agb-3-1-3"
  },
  "sec:3.1.4": {
   "file": "03-ground-cancellation",
   "anchor": "sec-atbd-agb-3-1-4"
  },
  "sec:3.1.5": {
   "file": "03-ground-cancellation",
   "anchor": "sec-atbd-agb-3-1-5"
  },
  "sec:3.2": {
   "file": "03-ground-cancellation",
   "anchor": "sec-atbd-agb-3-2"
  },
  "sec:3.2.1": {
   "file": "03-ground-cancellation",
   "anchor": "sec-atbd-agb-3-2-1"
  },
  "sec:3.2.2": {
   "file": "03-ground-cancellation",
   "anchor": "sec-atbd-agb-3-2-2"
  },
  "sec:3.2.3": {
   "file": "03-ground-cancellation",
   "anchor": "sec-atbd-agb-3-2-3"
  },
  "sec:3.2.4": {
   "file": "03-ground-cancellation",
   "anchor": "sec-atbd-agb-3-2-4"
  },
  "sec:3.2.4.1": {
   "file": "03-ground-cancellation",
   "anchor": "sec-atbd-agb-3-2-4-1"
  },
  "sec:3.3": {
   "file": "03-ground-cancellation",
   "anchor": "sec-atbd-agb-3-3"
  },
  "sec:3.3.1": {
   "file": "03-ground-cancellation",
   "anchor": "sec-atbd-agb-3-3-1"
  },
  "sec:3.3.2": {
   "file": "03-ground-cancellation",
   "anchor": "sec-atbd-agb-3-3-2"
  },
  "sec:3.3.3": {
   "file": "03-ground-cancellation",
   "anchor": "sec-atbd-agb-3-3-3"
  },
  "sec:3.3.4": {
   "file": "03-ground-cancellation",
   "anchor": "sec-calibration-math"
  },
  "sec:3.4": {
   "file": "03-ground-cancellation",
   "anchor": "sec-atbd-agb-3-4"
  },
  "sec:3.4.1": {
   "file": "03-ground-cancellation",
   "anchor": "sec-atbd-agb-3-4-1"
  },
  "sec:3.4.2": {
   "file": "03-ground-cancellation",
   "anchor": "sec-atbd-agb-3-4-2"
  },
  "sec:3.4.3": {
   "file": "03-ground-cancellation",
   "anchor": "sec-ground-cancellation-outputs"
  },
  "sec:3.4.4": {
   "file": "03-ground-cancellation",
   "anchor": "sec-atbd-agb-3-4-4"
  },
  "sec:3.4.4.1": {
   "file": "03-ground-cancellation",
   "anchor": "sec-ground-cancellation-two-images"
  },
  "sec:3.4.4.2": {
   "file": "03-ground-cancellation",
   "anchor": "interpolated-ground-cancellation-single-reference"
  },
  "sec:3.4.4.2.1": {
   "file": "03-ground-cancellation",
   "anchor": "reference-acquisition-selection"
  },
  "sec:3.4.4.2.2": {
   "file": "03-ground-cancellation",
   "anchor": "multi-reference-selection"
  },
  "sec:3.5": {
   "file": "03-ground-cancellation",
   "anchor": "sec-atbd-agb-3-5"
  },
  "sec:3.5.1": {
   "file": "03-ground-cancellation",
   "anchor": "sec-atbd-agb-3-5-1"
  },
  "sec:3.5.2": {
   "file": "03-ground-cancellation",
   "anchor": "sec-atbd-agb-3-5-2"
  },
  "sec:3.5.3": {
   "file": "03-ground-cancellation",
   "anchor": "sec-atbd-agb-3-5-3"
  },
  "sec:3.5.4": {
   "file": "03-ground-cancellation",
   "anchor": "sec-atbd-agb-3-5-4"
  },
  "sec:3.5.5": {
   "file": "03-ground-cancellation",
   "anchor": "sec-atbd-agb-3-5-5"
  },
  "sec:3.6": {
   "file": "03-ground-cancellation",
   "anchor": "sec-atbd-agb-3-6"
  },
  "sec:3.6.1": {
   "file": "03-ground-cancellation",
   "anchor": "sec-atbd-agb-3-6-1"
  },
  "sec:3.6.2": {
   "file": "03-ground-cancellation",
   "anchor": "sec-atbd-agb-3-6-2"
  },
  "sec:3.6.3": {
   "file": "03-ground-cancellation",
   "anchor": "sec-atbd-agb-3-6-3"
  },
  "sec:3.6.4": {
   "file": "03-ground-cancellation",
   "anchor": "sec-atbd-agb-3-6-4"
  },
  "sec:3.6.4.1.1": {
   "file": "03-ground-cancellation",
   "anchor": "sec-atbd-agb-3-6-4-1-1"
  },
  "sec:3.6.4.1.2": {
   "file": "03-ground-cancellation",
   "anchor": "sec-atbd-agb-3-6-4-1-2"
  },
  "sec:3.7": {
   "file": "03-ground-cancellation",
   "anchor": "sec-atbd-agb-3-7"
  },
  "sec:3.7.1": {
   "file": "03-ground-cancellation",
   "anchor": "sec-atbd-agb-3-7-1"
  },
  "sec:3.7.2": {
   "file": "03-ground-cancellation",
   "anchor": "sec-atbd-agb-3-7-2"
  },
  "sec:3.7.3": {
   "file": "03-ground-cancellation",
   "anchor": "sec-atbd-agb-3-7-3"
  },
  "sec:3.7.4": {
   "file": "03-ground-cancellation",
   "anchor": "sec-atbd-agb-3-7-4"
  },
  "sec:4": {
   "file": "04-agb-estimation",
   "anchor": "sec-atbd-agb-4"
  },
  "sec:4.1": {
   "file": "04-agb-estimation",
   "anchor": "sec-atbd-agb-4-1"
  },
  "sec:4.1.1": {
   "file": "04-agb-estimation",
   "anchor": "sec-atbd-agb-4-1-1"
  },
  "sec:4.1.2": {
   "file": "04-agb-estimation",
   "anchor": "sec-atbd-agb-4-1-2"
  },
  "sec:4.1.3": {
   "file": "04-agb-estimation",
   "anchor": "sec-atbd-agb-4-1-3"
  },
  "sec:4.1.4": {
   "file": "04-agb-estimation",
   "anchor": "sec-atbd-agb-4-1-4"
  },
  "sec:4.1.4.1": {
   "file": "04-agb-estimation",
   "anchor": "sec-atbd-agb-4-1-4-1"
  },
  "sec:4.1.4.2": {
   "file": "04-agb-estimation",
   "anchor": "sec-training-data-consolidation"
  },
  "sec:4.1.4.3": {
   "file": "04-agb-estimation",
   "anchor": "regression-based-parameter-estimation"
  },
  "sec:4.1.4.4": {
   "file": "04-agb-estimation",
   "anchor": "sec-atbd-agb-4-1-4-4"
  },
  "sec:4.1.4.5": {
   "file": "04-agb-estimation",
   "anchor": "sec-atbd-agb-4-1-4-5"
  },
  "sec:4.1.4.6": {
   "file": "04-agb-estimation",
   "anchor": "sec-atbd-agb-4-1-4-6"
  },
  "sec:5": {
   "file": "05-appendix",
   "anchor": "sec-atbd-agb-5"
  }
 }
}

docs/science-guide/atbd-l1-sar/04-l1-core-processing.md

$$
{PSD}_{CHIRP}(f_r,t)=\frac{\left\vert F_r(chirp(\tau)) \right\vert^2}{N_{chirp}}\sum_{j=-(M-1)/2}^{(M-1)/2}{\widehat{P_m}(t+j)}
\tag{4.10}
$$ (eq:atbd-l1-sar-4-10)

(equation-eq-atbd-l1-sar-4-11)=
\begin{equation}
Mask(f_r,t)=\begin{Bmatrix} 1,\ if\ 10\log_{10}({PSD}_{RAW}(f_r,t)/{PSD}_{CHIRP}(f_r,t))>k_p \\ 0,\ if\ 10\log_{10}({PSD}_{RAW}(f_r,t)/{PSD}_{CHIRP}(f_r,t))\leq{}k_p \end{Bmatrix}
\tag{4.11}
\end{equation}

$$
{PSD}_{CHIRP}(f_r,t)=\frac{\left\vert F_r(chirp(\tau)) \right\vert^2}{N_{chirp}}\widehat{P_m}(t)
\tag{4.12}
$$ (eq:atbd-l1-sar-4-12)

$$
{PSD}_{RAW}(f_r,t)=\frac{{PSD}_{RAW}(f_r,t)}{\frac{1}{N_r}\sum_{f_r=0}^{W-1}{\frac{{PSD}_{RAW}(f_r,t)}{{PSD}_{CHIRP}(f_r,t)}}}
\tag{4.13}
$$ (eq:atbd-l1-sar-4-13)

(equation-eq-atbd-l1-sar-4-14)=
\begin{equation}
F_r(RAW(\tau,t))=\begin{Bmatrix} 0,\ if\ Mask(f_r,t)=1 \\ F(RAW(\tau,t)),\ if\ Mask(f_r,t)=0 \end{Bmatrix}
\tag{4.14}
\end{equation}

$$
{p\_freq}_{a,affected}=\frac{N_{a,affected}}{N_a}
\tag{4.15}
$$ (eq:atbd-l1-sar-4-15)

$$
{p\_freq}_{r,avg\_affected}=\frac{1}{N_a}\sum_{n=0}^{N_a-1}{\frac{N_{r,affected}(n)}{N_r}}
\tag{4.16}
$$ (eq:atbd-l1-sar-4-16)

$$
{p\_freq}_{r,\max\_affected}=\max(\frac{N_{r,affected}(n)}{N_r})
\tag{4.17}
$$ (eq:atbd-l1-sar-4-17)

$$
chirp(\tau)=\frac{1}{\sqrt{N_r\bullet\frac{f_s}{B_r}}}\bullet\exp (j\pi{}K_r\tau^2+j2\pi{}f_r\left[ 1 \right]\tau+{j\varphi}_r\left[ 1 \right]),\ \ \ \tau\in\left[ 0,\tau_r \right]
\tag{4.18}
$$ (eq:atbd-l1-sar-4-18)

$$
\mathrm{\Delta}{SWP}_{sq}\left[ n \right]=\left\lceil (SWP\left[ n \right]-SWP\left[ 1 \right])\bullet{}f_s \right\rceil
\tag{4.19}
$$ (eq:atbd-l1-sar-4-19)

$$
\mathrm{\Delta}\tau\left[ n \right]=(SWP\left[ n \right]-SWP\left[ 1 \right])\bullet{}f_s-min(\mathrm{\Delta}{SWP}_{sq})
\tag{4.20}
$$ (eq:atbd-l1-sar-4-20)

$$
F(RAW\left[ n \right])'=F(RAW\left[ n \right])\bullet{}exp(-j2\pi\frac{f_r}{f_s}\mathrm{\Delta}\tau\left[ n \right])
\tag{4.21}
$$ (eq:atbd-l1-sar-4-21)

$$
\tau_0^{'}=\tau_0-\mathrm{\Delta}\tau\left[ 1 \right]
\tag{4.22}
$$ (eq:atbd-l1-sar-4-22)

$$
RGC(\tau,t)={RGC}_{nc}(\tau,t)\bullet\frac{A_{drift}^{ref}\cdot\exp (j\varphi_{drift}^{ref})}{A_{drift}(t)\bullet\exp(j\varphi_{drift}(t))}
\tag{4.23}
$$ (eq:atbd-l1-sar-4-23)

$$
RGC(\tau,t)={RGC}_{nc}(\tau,t)\bullet\frac{1}{I_{Tx}\bullet{}I_{Rx}}
\tag{4.24}
$$ (eq:atbd-l1-sar-4-24)

$$
\tau_0^{'}=\tau_0-\mathrm{\Delta}\tau
\tag{4.25}
$$ (eq:atbd-l1-sar-4-25)

(equation-eq-atbd-l1-sar-4-26)=
\begin{equation}
\begin{aligned}
t_0^{'}=t_0-\left\lfloor \mathrm{\Delta}\tau\bullet{}PRF \right\rfloor/PRF \\
\tau_0^{'}=\tau_0-(\mathrm{\Delta}\tau-\left\lfloor \mathrm{\Delta}\tau\bullet{}PRF \right\rfloor/PRF)
\end{aligned}
\tag{4.26}
\end{equation}

(equation-eq-atbd-l1-sar-4-27)=
\begin{equation}
\left\{ \begin{matrix} \left\vert {\overrightarrow{p}}_s-{\overrightarrow{p}}_e \right\vert=r \\ {\overrightarrow{n}}_{pp}\bullet({\overrightarrow{p}}_s-{\overrightarrow{p}}_e)=0 \\ \frac{p_{e,x}^2+p_{e,y}^2}{R_e}+\frac{p_{e,z}^2}{R_p}=1 \end{matrix} \right.
\tag{4.27}
\end{equation}

$$
f_{DC}=\frac{2{\overrightarrow{v}}_s\bullet({\overrightarrow{p}}_e-{\overrightarrow{p}}_s)}{\lambda{}r}
\tag{4.28}
$$ (eq:atbd-l1-sar-4-28)

$$
{\widehat{f}}_{DC}=\frac{\angle{}s_{i,j}\left[ 1 \right]}{2\pi}\bullet{}PRF
\tag{4.29}
$$ (eq:atbd-l1-sar-4-29)

(equation-eq-atbd-l1-sar-4-30)=
\begin{equation}
\begin{aligned}
s_{i,j}\left[ 1 \right]=\sum_{n=1}^N{s_{i,j}(n)\left[ 1 \right]} \\
s_{i,j}(n)\left[ 1 \right]=\ \sum_{m=1}^{M-1}{RGC(n,m)\bullet}{RGC(n,m+1)}^*
\end{aligned}
\tag{4.30}
\end{equation}

$$
\boldsymbol{r(\eta)=IFFT(}\boldsymbol{G}_{\boldsymbol{aap}}\boldsymbol{(}\boldsymbol{f}_{\boldsymbol{\eta}}\boldsymbol{)}{\boldsymbol{G}_{\boldsymbol{aap}}}^{\boldsymbol{*}}\boldsymbol{(}\boldsymbol{f}_{\boldsymbol{\eta}}\boldsymbol{))}
\tag{4.31}
$$ (eq:atbd-l1-sar-4-31)

$$
\boldsymbol{\sigma}_{\boldsymbol{N}}^{\boldsymbol{2}}\boldsymbol{=}\boldsymbol{R}_{\boldsymbol{0}}\boldsymbol{-}\frac{\boldsymbol{r(}\boldsymbol{\eta}_{\boldsymbol{0}}\boldsymbol{)}}{\boldsymbol{r(}\boldsymbol{\eta}_{\boldsymbol{1}}\boldsymbol{)}}\left\vert \boldsymbol{R}_{\boldsymbol{1}} \right\vert
\tag{4.32}
$$ (eq:atbd-l1-sar-4-32)

$$
SNR=\frac{R_0-\sigma_N^2}{\sigma_N^2}
\tag{4.33}
$$ (eq:atbd-l1-sar-4-33)

$$
A(f)=\ 1+m\ \cos (\frac{2\pi{}f}{PRF})
\tag{4.34}
$$ (eq:atbd-l1-sar-4-34)

$$
var(\varphi)=\frac{PRF^2}{2\pi^2N}(\frac{1}{\left[ m(SNR) \right]^2}+\frac{1}{4})
\tag{4.35}
$$ (eq:atbd-l1-sar-4-35)

$$
k=round(\frac{f_{DC}-{\widehat{f}}_{DC}}{PRF})
\tag{4.36}
$$ (eq:atbd-l1-sar-4-36)

$$
r(t_a;\ r_0,\ t_0)\approx\sqrt{r_0^2+v_e(r_0)\cdot(t_a-t_0)^2},
\tag{4.37}
$$ (eq:atbd-l1-sar-4-37)

(equation-eq-atbd-l1-sar-4-38)=
\begin{equation}
\left\{ \begin{matrix} \left\vert {\overrightarrow{p}}_s(t_0)-{\overrightarrow{p}}_e \right\vert=r_0 \\ ({\overrightarrow{p}}_s(t_0)-{\overrightarrow{p}}_e)\cdot{\overrightarrow{v}}_s(t_0)=0 \\ \frac{p_{e,x}^2+p_{e,y}^2}{R_e}+\frac{p_{e,z}^2}{R_p}=1 \end{matrix} \right.
\tag{4.38}
\end{equation}

$$
v_{e,i}(r_{0,i},t_0)\approx\sqrt{\left\vert {\overrightarrow{v}}_s(t_0) \right\vert^2+({\overrightarrow{p}}_s(t_0)-{\overrightarrow{p}}_{e,i})\cdot{\overrightarrow{a}}_s(t_0)},
\tag{4.39}
$$ (eq:atbd-l1-sar-4-39)

$$
K_{a,i}=-\frac{2v_{e,i}^2\bullet\cos{(\beta)^3}}{\lambda\bullet{}r_{0,i}}
\tag{4.40}
$$ (eq:atbd-l1-sar-4-40)

$$
P^C(\theta,\beta,t)=\ \frac{\sum_{D\in{D1,D2}}^{}{a_D^C(t)P_D^C(\theta,\beta)}}{\sqrt{\sum_{D\in{D1,D2}}^{}{\left\vert a_D^C(t) \right\vert^2}}}
\tag{4.41}
$$ (eq:atbd-l1-sar-4-41)

where $\beta(f_a,\tau)$ is computed with {eq}`equation|4.38`. The co- and cross-antenna patterns are evaluated / interpolated for the required azimuth frequency positions. As in APC1, two-way patterns are obtained from doublet patterns combined with power tracking coefficients that are averaged over each azimuth block;

- $G_{SL}(\tau,t)=(\frac{r_{ref}}{r(\tau,t)})^{\frac{3}{2}}$ is the spread-loss range-dependent gain compensation factor ($r_{ref}$ is a configurable slant-range distance used as reference, default value equal to 671km, while $r=\tau\bullet\frac{c}{2}$);
- $G_{SF}=G_{SF0}\bullet{\mathrm{\Delta}G}_{SF}$ is the scaling factor aimed at compensating the radiometric bias introduced by the processor. This factor includes two components: $G_{SF0}$, automatically computed by the processor (see also {sec}`4.15`), and ${\mathrm{\Delta}G}_{SF}$, provided via configuration and polarization dependent;
- $G_{AC}$ is the absolute calibration constant, provided via configuration and polarization dependent.

2. Once the SLC is focused at the ionospheric altitude, the ionospheric phase screen can be compensated by multiplying $\exp (-i\phi_{iono})$, where $\phi_{iono}$ is obtained by any means of FR (see {sec}`4.10.3.1`) or autofocus (see {sec}`4.11`):

- $G_{CH}$ is the calibrated chirp amplitude used during Range Compression step (see {sec}`4.2.1`);
- $G_{AP}$ is the elevation antenna pattern gain at Doppler zero, provided in output by the antenna patter compensation step (see {sec}`4.6`);
- $G_{SL}$ is the spread-loss factor (see {sec}`4.8`);
- $G_{SF}$ is the processing scaling factor (see {sec}`4.8` and {sec}`4.15`);
- $G_{AC}$ is the absolute calibration constant (see {sec}`4.8`).

where $\sigma_{noise}^2$ is the noise power measurement derived from internal calibration packets (see {sec}`3.3.7`), linearly interpolated along azimuth direction and then shaped by all the radiometric corrections applied during processing, while $k_{noise}$ is the calibration factor, provided via configuration and polarization dependent. This value compensates for both the difference in the processing scaling factor for signal and noise components (see {sec}`4.15`) and for any other scale factor to perform noise power bit-to-Watt conversion.